id	label	predict1	explanation1	error1
214	curiosity	confusion	The speaker's statement indicates a lack of understanding or clarity about the situation regarding 'her' presence. The phrase 'Doesn't seem like a big deal' suggests uncertainty, and the follow-up question 'is she in the room?' reinforces the confusion. There is no apparent positive or negative emotion expressed, but rather an inquiry that stems from perplexity about the circumstances.	0
216	annoyance	anger	The phrase 'We were all duped' indicates feelings of betrayal or frustration aimed at the subject being discussed. The speaker expresses a strong negative sentiment towards the person referred to as 'her,' suggesting they feel misled or deceived. The use of 'fake' emphasizes disapproval and contempt, highlighting the intensity of the speaker's emotional response.	0
217	sadness	sadness	The use of the word 'at least' indicates a sense of resignation or acceptance of a less than ideal situation, which conveys disappointment. The emoticon '(:' further underscores a feeling of sadness or loss regarding the removal of the show from Netflix in Canada.	0
219	neutral	surprise	The use of 'That's the first time' indicates that the speaker is expressing shock or astonishment at an unexpected behavior from OG, which implies a sense of surprise at the occurrence.	0
221	neutral	disappointment	The speaker expresses dissatisfaction and frustration with the job market, labeling available positions as 'mostly shit paying jobs' which conveys a sense of discontent. The mention of older people rejoining the workforce suggests a negative perspective on the quality of job opportunities, implying a bleak assessment of the situation. The phrase 'Ofc they will spin it as 	0
222	disappointment	annoyance	The phrase 'This shirt IS a problem' indicates a strong negative sentiment towards the shirt, suggesting that it causes irritation or frustration. The directive 'Get rid of it' implies a desire to eliminate this source of annoyance, reinforcing the emotion of annoyance rather than expressing mere disapproval or disgust.	0
224	love	joy	The phrase 'I really like this photo' expresses a positive sentiment and an appreciation for the image, indicating a sense of joy and pleasure derived from it.	0
228	gratitude	disgust	The phrase 'i hate it' explicitly expresses a strong negative feeling towards something, which suggests contempt or revulsion. Additionally, describing someone as 'goal-less' carries a negative connotation, implying a lack of purpose or ambition, which could further evoke feelings of distaste or disdain in the speaker.	0
229	neutral	confusion	The phrase 'I am still a child' reflects a sense of uncertainty and self-awareness about one's maturity or place in life. It suggests an internal conflict regarding age and growth, which can lead to feelings of confusion about identity and expectations.	0
230	annoyance	disapproval	The statement expresses a negative judgment about the person being addressed, implying that they take the game too seriously and lack a fulfilling life outside of it. This conveys disapproval of their priorities and demeanor, suggesting a critical perspective towards their involvement in the game.	0
235	disappointment	disappointment	The statement expresses a sense of regret or frustration about the lack of fiber internet options in Suiderstrand, indicated by the use of 'unfortunately' and the sad face emoticon '(:'. This conveys a feeling of disappointment regarding the current living situation.	0
241	approval	joy	The speaker expresses enthusiasm and happiness about the start of Season 2, indicating a positive emotional connection to the series. The use of 'huge TNG fan' highlights their admiration and excitement, suggesting a sense of joy in finding something enjoyable that parallels a beloved favorite.	0
242	neutral	anger	The sentence expresses strong indignation towards someone who disagrees with Oxford. The use of phrases like 'go live in a damn cave' indicates frustration and a confrontational attitude. Although there is a positive mention of love for England, the dominant tone is one of anger directed at the disagreement.	0
244	confusion	amusement	The phrase 'for fun' suggests a lighthearted and playful context. The use of 'Idk' (I don't know) implies a carefree attitude, indicating that the speaker is not taking the situation seriously. This combination evokes a sense of amusement and suggests a casual, enjoyable experience.	0
245	approval	optimism	The phrase 'makes us more determined' indicates a positive motivation and a strong commitment to achieving a goal, which in this context is likely related to hoping for a favorable outcome in sports (tanking for Zion Williamson). The use of 'determined' reflects a hopeful and proactive attitude, aligning with the emotion of optimism.	0
249	neutral	disapproval	The statement expresses a feeling of discontent or dissatisfaction with the r/hockey community's lack of appreciation ('no love for us'). The phrase suggests a rejection of that community and an appeal to stay amongst those who are perceived as 'cool,' indicating a judgment about the worthiness of the other group, which indicates an emotional stance of disapproval.	0
250	disapproval	disapproval	The speaker expresses a lack of concern and a dismissive attitude towards the groups mentioned, indicating a critical perspective. The phrase 'makes little difference anyway' suggests a negative evaluation and shows disapproval of how the situation is being perceived or treated.	0
257	admiration	joy	The use of 'Oh yeah!' expresses a sense of delight or excitement upon recalling a positive memory. The context of discussing a player's impressive statistics (0.69 ERA, 10.7 K/9) suggests a fondness and appreciation for their performance, contributing to an overall joyful sentiment.	0
260	disapproval	annoyance	The tone of the sentence indicates frustration with a previous response that lacked specificity and depth. The speaker is expressing irritation over the vague suggestion to 'Google it' instead of providing direct sources, which implies a desire for more thorough and concrete information.	0
262	neutral	anger	The phrase 'Saying babcuck should be fired' expresses a strong opinion that implies a sense of injustice or frustration towards a person's position. The use of 'woke' suggests a dismissive attitude toward progressive ideas, and 'gimme updoots' implies a desire for validation or agreement, which further indicates a combative or aggressive tone. Overall, the language conveys a sense of anger toward the situation and possibly towards those who hold opposing views.	0
267	optimism	anger	The statement reflects a strong negative sentiment towards 'them,' indicating that the speaker harbors resentment or hostility towards a particular group. The wish for someone to live an extraordinarily long life is not out of genuine caring, but rather as a means to irritate or anger others, signifying underlying anger or frustration.	0
268	amusement	amusement	The use of 'lol' indicates that the speaker finds humor in the situation, specifically regarding the absence of a 'maybe later' option in the question. The light-hearted tone suggests amusement rather than frustration.	0
270	neutral	disapproval	The sentence expresses a negative view towards a perspective or idea, suggesting that it is flawed because it fails to account for a fair outcome. The phrase 'there has to be a loser in his eyes' indicates a critical stance, implying discontent with the notion that everyone could be satisfied. This disapproval of an unfair situation aligns well with the emotional category of disapproval.	0
273	neutral			1
274	surprise	surprise	The phrase 'pleasantly surprised' indicates a positive unexpected reaction, which fits well within the emotion of surprise. The use of 'more than' amplifies the sentiment, suggesting that the surprise is both significant and positive, without introducing any negative feelings.	0
275	annoyance	curiosity	The statement expresses a sense of wonder about the unusual weather patterns observed, as indicated by the mention of 'crazy stuff.' This suggests an inquisitive attitude towards the changing weather, which aligns with the emotion of curiosity.	0
279	disapproval	confusion	The phrase suggests a lack of clarity regarding what 'something else' is needed for 'it' to live. The wording indicates uncertainty about a situation or concept, which aligns with the emotion of confusion.	0
281	amusement	joy	The speaker expresses a sense of joy through the enthusiasm in their message, particularly when they mention sharing laughter with others who appreciate their humor. This indicates a positive connection with those who 'get' their humor, leading to the enjoyment of shared moments, which is a key aspect of joy.	0
286	neutral	neutral	The statement presents a factual observation without conveying any strong emotional undertone. It simply emphasizes the significance of the number zero in a straightforward manner.	0
287	neutral	neutral	The sentence presents factual information about a person’s past role as a director and their action of purchasing something. It lacks any strong emotional language or implications, indicating a straightforward statement without emotional engagement.	0
289	neutral	fear	The sentence implies a strong sense of vulnerability and concern for personal safety. The phrase 'would never just kill me like that' indicates a fear of betrayal or harm from close family members, highlighting an underlying anxiety about interpersonal trust and safety.	0
291	admiration	amusement	The phrase 'Good news' suggests a light-hearted or humorous tone, while the comparison between 'shark tale' and 'finding Nemo' indicates a playful twist. The speaker seems to be drawing attention to a contrast in animated movies, which is often a source of amusement due to the inherent rivalry or differing qualities of film franchises.	0
294	curiosity	curiosity	The question expressed seeks information about someone's current physical state or location, indicating a desire to know whether the person is still in the car. This reflects curiosity about the person's situation.	0
296	optimism	nervousness	The sentence conveys a sense of unease or anxiety about the potential for [NAME] to 'lose it'—which typically implies a breakdown or loss of control. The phrase 'just hope it's not tonight' suggests a concern about an imminent event, which further indicates feelings of nervousness regarding the situation.	0
297	disgust	embarrassment	The phrase 'I feel awful posting it' indicates a sense of shame or discomfort about sharing something, which aligns with feelings of embarrassment. The use of 'couldn’t not share' suggests a conflict between the desire to conceal the post and an overwhelming need to share it, further emphasizing the feeling of being self-conscious or inattentive to one's own image.	0
299	surprise			
